id,name,iconId,mapId,passCrisisMoney,passCrisisSense,passCrisisPropsId,crisisIdList,bossID,bossDes,des
1,来自未来的少年,1,1,10000,10000,0,1,1009,人造人追击部队的总指挥，虽然只是短暂的交手，却能看出其强大的实力,来自未来的特兰克斯，带领着和他有着同样使命的少年，通过时空穿梭机，返回那个传说中的龙珠的世界。这个旅程并非想象中那般顺利，人造人的追击部队尾随而至，战斗一触即发
2,龙珠的世界,2,2,10000,10000,0,"2,3,4,5",1060,悟空变身强大的巨猿，不受控制的开始进行破坏,龙珠的世界，包子山。传说中的英雄孙悟空还是小孩子。来到这个世界的少年们，将和传说中的英雄一起成长。森林里的比赛，村子里的怪兽，沙漠中的对决，以及神龙的初次现身，冒险由此展开
3,龟仙岛的修炼,3,3,10000,10000,0,"6,7,8",1060,务必要粉碎黑绸军的阴谋,龟仙岛开始修炼，遇到了更多的伙伴，也第一次遭遇了黑绸缎军。这一次黑绸军的目标，是海盗洞穴沉睡的宝藏，或许，事情并没有表面上看起来那么简单
4,天下第一武道大会,4,4,10000,10000,0,"9,10,11",1200,秦龙老师无疑是武道会最具实力的选手,天下第一武道大会汇集了世界各地的好手，争夺冠军的荣誉。不过，有诸如悟空、秦龙一般的高手，想要杀出重围并不是一件简单的事
5,再踏征途,5,5,10000,10000,0,"12,13,14",1269,桃白白号称天下第一杀手,天下第一杀手桃白白，对面敌人毫无不留情，左手藏剑，右手还拥有最强大的技能“超级咚咚波”
6,集齐龙珠,6,6,10000,10000,0,"15,16,17,",1344,小悟空的爷爷,小悟空的爷爷，龟仙人门下最强的弟子，被小悟空变成猿人后杀死，被水晶婆婆从地狱带出来，功夫高强，想要通过他的考验不是一件简单的事情。
7,可怕的阴谋,7,7,10000,10000,0,"18,19,20",10486,短笛大魔王,短笛大魔王，杀死了众多Z战士，但被孙悟空打败。因此一直修行。之后力量非常强大
8,魔王来袭,8,8,10000,10000,0,"21,22,23",10536,短笛大魔王,短笛大魔王，杀死了众多Z战士，但被孙悟空打败。因此一直修行。之后力量非常强大
